{
  "schema_version": "1",
  "id": "maniskill-xarm6-pick-cube",
  "name": "ManiSkill xarm6_robotiq PickCube-v1 motion planner",
  "summary": "Grasp a cube and move it to a goal with the official xArm6 Robotiq solver.",
  "capabilities": [
    "grasping",
    "pick-and-place",
    "motion-planning"
  ],
  "aliases": [
    "PickCube-v1",
    "xarm6_robotiq",
    "xarm6",
    "xarm6_pick_cube",
    "robot manipulation",
    "reusable Python code"
  ],
  "source": {
    "repository": "https://github.com/haosulab/ManiSkill",
    "commit": "33967b9e3ead1f841eec57cc9f31d0d8b8cf0907",
    "tag": "v3.0.0b22",
    "paths": [
      "mani_skill/examples/motionplanning/xarm6/run.py",
      "mani_skill/examples/motionplanning/xarm6/solutions/pick_cube.py",
      "mani_skill/envs/tasks/tabletop/pick_cube.py",
      "setup.py",
      "LICENSE"
    ],
    "archive_url": "https://codeload.github.com/haosulab/ManiSkill/tar.gz/33967b9e3ead1f841eec57cc9f31d0d8b8cf0907",
    "archive_sha256": "d194e39e4f86063f7ea49f25c918ca7474d088ad8d5abdc37573daf4672f86d4",
    "archive_bytes": 243636110,
    "authors": [
      "ManiSkill contributors"
    ],
    "contributing_url": "https://github.com/haosulab/ManiSkill/tree/33967b9e3ead1f841eec57cc9f31d0d8b8cf0907"
  },
  "license": {
    "spdx": "Apache-2.0",
    "url": "https://github.com/haosulab/ManiSkill/blob/33967b9e3ead1f841eec57cc9f31d0d8b8cf0907/LICENSE",
    "verified": true,
    "scope": "Upstream ManiSkill code; hub wrapper and metadata use the hub LICENSE."
  },
  "compatibility": [
    {
      "runtime": "maniskill",
      "runtime_version": "3.0.0b22",
      "robot": "xarm6_robotiq",
      "controller": "pd_joint_pos",
      "observation": "state",
      "os": "linux",
      "architecture": "x86_64",
      "python": "3.10",
      "status": "source_reviewed"
    }
  ],
  "observation": {
    "required": [
      "simulator_state"
    ],
    "privileged_state": true,
    "description": "Reads ground-truth object poses, collision geometry and robot state directly from the simulator. Not an RGB-only policy."
  },
  "requirements": {
    "python": ">=3.10,<3.11",
    "packages": [
      "torch==2.5.1",
      "numpy==1.26.4",
      "sapien==3.0.0",
      "mplib==0.1.1",
      "fast_kinematics==0.2.2"
    ],
    "hardware": [
      "Linux x86_64 CPU; SAPIEN wheel needs glibc >=2.28"
    ],
    "rendering": "disabled explicitly: render_backend=none, render_mode=None, state observations and CPU simulation; graphics paths require separate Vulkan setup",
    "api_keys": [],
    "network": [
      "GitHub source archive (~233 MiB)",
      "PyPI and dependency distributions; source package build hooks may execute"
    ],
    "dependency_lock": "Direct dependencies pinned; transitive dependencies resolved by pip and captured in the prepared project. No bit-for-bit environment guarantee."
  },
  "invocation": {
    "entrypoint": "mani_skill.examples.motionplanning.xarm6.solutions.pick_cube:solve",
    "argv": [
      "{python}",
      "{recipe_dir}/run.py",
      "--seed",
      "0"
    ],
    "inputs": {
      "task": "PickCube-v1",
      "seed": 0,
      "robot": "xarm6_robotiq",
      "controller": "pd_joint_pos",
      "obs_mode": "state",
      "sim_backend": "cpu",
      "render_backend": "none",
      "reward_mode": "sparse"
    },
    "outputs": {
      "format": "last stdout line JSON",
      "fields": [
        "status",
        "success",
        "elapsed_steps",
        "task",
        "seed",
        "runtime",
        "robot",
        "controller",
        "observation",
        "sim_backend",
        "render_backend"
      ],
      "error_fields": [
        "status",
        "reason_code",
        "error_type",
        "message"
      ]
    },
    "example": "python skills/find-robot-skills/scripts/rsh.py prepare maniskill-xarm6-pick-cube --project ./experiment --json"
  },
  "completion": {
    "success_condition": "PickCube-v1 env info.success is true after the upstream solver finishes; exit 0 requires success.",
    "timeout_seconds": 300,
    "failure_modes": [
      "Dependency installation unavailable or incompatible",
      "Required Linux mplib wheels unavailable on host OS",
      "Motion planning reports failure or env info.success is false",
      "Runtime exception or asset download failure"
    ],
    "stop_condition": "Stop after one seed; no automatic retries. Use an external 300-second process timeout."
  },
  "preparation": {
    "recipe_path": "recipes/maniskill-xarm6-pick-cube",
    "requirements_file": "recipes/maniskill-xarm6-pick-cube/requirements.txt",
    "install_argv": [
      "{python}",
      "-m",
      "pip",
      "install",
      "-r",
      "{recipe_dir}/requirements.txt",
      "{source_dir}"
    ],
    "execution_separate": true
  },
  "evidence": {
    "level": "source_reviewed",
    "verified_by": "Robot Skill Hub source review",
    "date": "2026-10-17",
    "environment": {
      "source": "pinned upstream release",
      "host": "Windows source inspection"
    },
    "commands": [
      "python tools/import_official_samples.py --archive .local/upstream/maniskill-33967b9.tar.gz --check",
      "python -m unittest discover -s tests/python -p test_bulk_catalog.py"
    ],
    "result": "Inspected the pinned solver signature, task registration, source license and wrapper contract. No simulator invocation evidence is attached.",
    "artifacts": [],
    "runtime_verification": "not_run",
    "contributor_reported": null,
    "hub_verification": {
      "level": "source_reviewed",
      "runtime": "not_run"
    }
  },
  "maintenance": {
    "record_version": "1.0.0",
    "last_checked": "2026-10-17",
    "upstream_status": "pinned_release; no automatic update"
  },
  "contribution": {
    "allowed_paths": [
      "catalog/records/maniskill-xarm6-pick-cube.json",
      "docs/recipes/maniskill-xarm6-pick-cube.md",
      "recipes/maniskill-xarm6-pick-cube/requirements.txt",
      "recipes/maniskill-xarm6-pick-cube/run.py"
    ],
    "instructions": "Only actual reusable fixes. Public submission permission and a scoped pilot token are separate requirements. Submission opens a public internal draft PR; it is not publication."
  }
}
