{
  "schema_version": "1",
  "id": "maniskill-xarm6-stack-cube",
  "name": "ManiSkill xarm6_robotiq StackCube-v1 motion planner",
  "summary": "Stack one cube on another with the official xArm6 Robotiq solver.",
  "capabilities": [
    "stacking",
    "pick-and-place",
    "motion-planning"
  ],
  "aliases": [
    "StackCube-v1",
    "xarm6_robotiq",
    "xarm6",
    "xarm6_stack_cube",
    "robot manipulation",
    "reusable Python code"
  ],
  "source": {
    "repository": "https://github.com/haosulab/ManiSkill",
    "commit": "33967b9e3ead1f841eec57cc9f31d0d8b8cf0907",
    "tag": "v3.0.0b22",
    "paths": [
      "mani_skill/examples/motionplanning/xarm6/run.py",
      "mani_skill/examples/motionplanning/xarm6/solutions/stack_cube.py",
      "mani_skill/envs/tasks/tabletop/stack_cube.py",
      "setup.py",
      "LICENSE"
    ],
    "archive_url": "https://codeload.github.com/haosulab/ManiSkill/tar.gz/33967b9e3ead1f841eec57cc9f31d0d8b8cf0907",
    "archive_sha256": "d194e39e4f86063f7ea49f25c918ca7474d088ad8d5abdc37573daf4672f86d4",
    "archive_bytes": 243636110,
    "authors": [
      "ManiSkill contributors"
    ],
    "contributing_url": "https://github.com/haosulab/ManiSkill/tree/33967b9e3ead1f841eec57cc9f31d0d8b8cf0907"
  },
  "license": {
    "spdx": "Apache-2.0",
    "url": "https://github.com/haosulab/ManiSkill/blob/33967b9e3ead1f841eec57cc9f31d0d8b8cf0907/LICENSE",
    "verified": true,
    "scope": "Upstream ManiSkill code; hub wrapper and metadata use the hub LICENSE."
  },
  "compatibility": [
    {
      "runtime": "maniskill",
      "runtime_version": "3.0.0b22",
      "robot": "xarm6_robotiq",
      "controller": "pd_joint_pos",
      "observation": "state",
      "os": "linux",
      "architecture": "x86_64",
      "python": "3.10",
      "status": "source_reviewed"
    }
  ],
  "observation": {
    "required": [
      "simulator_state"
    ],
    "privileged_state": true,
    "description": "Reads ground-truth object poses, collision geometry and robot state directly from the simulator. Not an RGB-only policy."
  },
  "requirements": {
    "python": ">=3.10,<3.11",
    "packages": [
      "torch==2.5.1",
      "numpy==1.26.4",
      "sapien==3.0.0",
      "mplib==0.1.1",
      "fast_kinematics==0.2.2"
    ],
    "hardware": [
      "Linux x86_64 CPU; SAPIEN wheel needs glibc >=2.28"
    ],
    "rendering": "Output rendering disabled: render_backend=none, render_mode=None, state observations and CPU simulation. Pinned SAPIEN material initialization may still require a usable Vulkan ICD. CPU Mesa lavapipe initialization was verified for the initial PickCube/StackCube recipes, not for this task.",
    "api_keys": [],
    "network": [
      "GitHub source archive (~233 MiB)",
      "PyPI and dependency distributions; source package build hooks may execute"
    ],
    "dependency_lock": "Direct dependencies pinned; transitive dependencies resolved by pip and captured in the prepared project. No bit-for-bit environment guarantee."
  },
  "invocation": {
    "entrypoint": "mani_skill.examples.motionplanning.xarm6.solutions.stack_cube:solve",
    "argv": [
      "{python}",
      "{recipe_dir}/run.py",
      "--seed",
      "0"
    ],
    "inputs": {
      "task": "StackCube-v1",
      "seed": 0,
      "robot": "xarm6_robotiq",
      "controller": "pd_joint_pos",
      "obs_mode": "state",
      "sim_backend": "cpu",
      "render_backend": "none",
      "reward_mode": "sparse",
      "max_episode_steps": 1000
    },
    "outputs": {
      "format": "last stdout line JSON",
      "fields": [
        "status",
        "success",
        "elapsed_steps",
        "task",
        "seed",
        "runtime",
        "robot",
        "controller",
        "observation",
        "sim_backend",
        "render_backend",
        "max_episode_steps",
        "terminated",
        "truncated"
      ],
      "error_fields": [
        "status",
        "reason_code",
        "error_type",
        "message"
      ]
    },
    "example": "python skills/find-robot-skills/scripts/rsh.py prepare maniskill-xarm6-stack-cube --project ./experiment --json"
  },
  "completion": {
    "success_condition": "StackCube-v1 env info.success is true after the upstream solver finishes, truncated is false, and 0 < elapsed_steps < max_episode_steps=1000; only then status is task_complete and exit is 0. The 1000-step motion-planning horizon is a Hub recipe condition, not the upstream default benchmark horizon.",
    "timeout_seconds": 300,
    "failure_modes": [
      "Dependency installation unavailable or incompatible",
      "Required Linux mplib wheels unavailable on host OS",
      "Motion planning reports failure or env info.success is false",
      "Runtime exception or asset download failure",
      "Episode truncated or elapsed_steps reaches the Hub 1000-step horizon"
    ],
    "stop_condition": "Stop after one seed; no automatic retries. Use an external 300-second process timeout."
  },
  "preparation": {
    "recipe_path": "recipes/maniskill-xarm6-stack-cube",
    "requirements_file": "recipes/maniskill-xarm6-stack-cube/requirements.txt",
    "install_argv": [
      "{python}",
      "-m",
      "pip",
      "install",
      "-r",
      "{recipe_dir}/requirements.txt",
      "{source_dir}"
    ],
    "execution_separate": true
  },
  "evidence": {
    "level": "source_reviewed",
    "verified_by": "Robot Skill Hub source review",
    "date": "2026-10-17",
    "environment": {
      "source": "pinned upstream release",
      "host": "Windows source inspection"
    },
    "commands": [
      "python tools/import_official_samples.py --archive .local/upstream/maniskill-33967b9.tar.gz --check",
      "python -m unittest discover -s tests/python -p test_bulk_catalog.py"
    ],
    "result": "Inspected the pinned solver signature, task registration, source license and wrapper contract. No simulator invocation evidence is attached. Version 1.1.0 explicitly sets a Hub 1000-step horizon and rejects truncated results; this updated wrapper has not been run in a simulator.",
    "artifacts": [],
    "runtime_verification": "not_run",
    "contributor_reported": null,
    "hub_verification": {
      "level": "source_reviewed",
      "runtime": "not_run"
    }
  },
  "maintenance": {
    "record_version": "1.1.0",
    "last_checked": "2026-10-18",
    "upstream_status": "pinned_release; no automatic update"
  },
  "contribution": {
    "allowed_paths": [
      "catalog/records/maniskill-xarm6-stack-cube.json",
      "docs/recipes/maniskill-xarm6-stack-cube.md",
      "recipes/maniskill-xarm6-stack-cube/requirements.txt",
      "recipes/maniskill-xarm6-stack-cube/run.py"
    ],
    "instructions": "Only actual reusable fixes. Public submission permission and a scoped pilot token are separate requirements. Submission opens a public internal draft PR; it is not publication."
  },
  "interface": {
    "version": "1",
    "kind": "task",
    "abstraction_level": 2,
    "execution_domain": "simulation",
    "language": "python",
    "input_transport": "cli_arguments",
    "output_transport": "json_stdout",
    "output_selector": "root",
    "conventions": {
      "linear_unit": "m",
      "angular_unit": "rad",
      "time_unit": "s",
      "coordinate_frame": "maniskill_world_xyz_z_up",
      "joint_order": "pinned_robot_model_order; pd_joint_pos controller",
      "quaternion_order": "not_exposed_by_this_adapter"
    },
    "input_schema": {
      "type": "object",
      "required": [
        "seed"
      ],
      "additionalProperties": false,
      "properties": {
        "seed": {
          "type": "integer",
          "minimum": 0,
          "maximum": 4294967295,
          "x-unit": "dimensionless",
          "description": "Simulation reset seed; task, robot, controller, state observation and 1000-step horizon are fixed by this recipe."
        }
      }
    },
    "output_schema": {
      "type": "object",
      "required": [
        "status"
      ],
      "additionalProperties": true,
      "properties": {
        "status": {
          "type": "string",
          "maxLength": 80
        }
      }
    },
    "argument_map": {
      "seed": "--seed"
    },
    "preconditions": [
      "Use the exact declared runtime/robot/environment combination.",
      "Ground-truth state and environment-generated targets; this adapter accepts a seed, not an arbitrary Cartesian goal."
    ],
    "postconditions": [
      "StackCube-v1 env info.success is true after the upstream solver finishes, truncated is false, and 0 < elapsed_steps < max_episode_steps=1000; only then status is task_complete and exit is 0. The 1000-step motion-planning horizon is a Hub recipe condition, not the upstream default benchmark horizon."
    ],
    "failure_codes": [
      "Dependency installation unavailable or incompatible",
      "Required Linux mplib wheels unavailable on host OS",
      "Motion planning reports failure or env info.success is false",
      "Runtime exception or asset download failure",
      "Episode truncated or elapsed_steps reaches the Hub 1000-step horizon"
    ],
    "composition": {
      "depends_on": [],
      "automatic_frame_conversion": false,
      "automatic_hardware_execution": false
    }
  }
}
